{
  "schema_version": 1,
  "version": "1.1.0",
  "license": "AGPL-3.0-or-later",
  "entries": [
    {
      "lemma": "أخير",
      "root": "أخر",
      "pattern": "فعيل",
      "pos": "adjective",
      "frequency": 6900,
      "features": {
        "gender": "masculine"
      },
      "forms": [
        {
          "form": "أخيرة",
          "features": {
            "gender": "feminine"
          }
        }
      ]
    },
    {
      "lemma": "أربع",
      "root": "ربع",
      "pattern": "أفعل",
      "pos": "noun",
      "frequency": 6500,
      "features": {
        "semantic": "numeral"
      },
      "forms": [
        {
          "form": "أربعة",
          "features": {
            "gender": "masculine_form"
          }
        }
      ]
    },
    {
      "lemma": "أسبوع",
      "root": "سبع",
      "pattern": "أفعول",
      "pos": "noun",
      "frequency": 6100,
      "features": {
        "gender": "masculine"
      },
      "forms": [
        {
          "form": "أسابيع",
          "features": {
            "number": "plural"
          }
        }
      ]
    },
    {
      "lemma": "أستاذ",
      "root": "أستاذ",
      "pattern": "جامد",
      "pos": "noun",
      "frequency": 7000,
      "features": {
        "gender": "masculine"
      },
      "forms": [
        {
          "form": "أساتذة",
          "features": {
            "number": "plural"
          }
        },
        {
          "form": "أستاذة",
          "features": {
            "gender": "feminine"
          }
        }
      ]
    },
    {
      "lemma": "أعلن",
      "root": "علن",
      "pattern": "أفعل",
      "pos": "verb",
      "frequency": 6100,
      "features": {},
      "forms": [
        {
          "form": "يعلن",
          "features": {
            "aspect": "imperfect"
          }
        }
      ]
    },
    {
      "lemma": "أمر",
      "root": "أمر",
      "pattern": "فعل",
      "pos": "noun",
      "frequency": 9600,
      "features": {
        "gender": "masculine"
      },
      "forms": [
        {
          "form": "أمور",
          "features": {
            "number": "plural"
          }
        }
      ]
    },
    {
      "lemma": "أمس",
      "root": null,
      "pattern": null,
      "pos": "adverb",
      "frequency": 13000,
      "features": {
        "closed_class": true
      },
      "forms": []
    },
    {
      "lemma": "أن",
      "root": null,
      "pattern": null,
      "pos": "particle",
      "frequency": 21250,
      "features": {
        "closed_class": true
      },
      "forms": []
    },
    {
      "lemma": "أنا",
      "root": null,
      "pattern": null,
      "pos": "pronoun",
      "frequency": 15750,
      "features": {
        "closed_class": true
      },
      "forms": []
    },
    {
      "lemma": "أنت",
      "root": null,
      "pattern": null,
      "pos": "pronoun",
      "frequency": 15500,
      "features": {
        "closed_class": true
      },
      "forms": []
    },
    {
      "lemma": "أنتم",
      "root": null,
      "pattern": null,
      "pos": "pronoun",
      "frequency": 15250,
      "features": {
        "closed_class": true
      },
      "forms": []
    },
    {
      "lemma": "أنهى",
      "root": "نهي",
      "pattern": "أفعل",
      "pos": "verb",
      "frequency": 4700,
      "features": {},
      "forms": [
        {
          "form": "ينهي",
          "features": {
            "aspect": "imperfect"
          }
        }
      ]
    },
    {
      "lemma": "أو",
      "root": null,
      "pattern": null,
      "pos": "particle",
      "frequency": 19000,
      "features": {
        "closed_class": true
      },
      "forms": []
    },
    {
      "lemma": "أيضًا",
      "root": null,
      "pattern": null,
      "pos": "adverb",
      "frequency": 12500,
      "features": {
        "closed_class": true
      },
      "forms": []
    },
    {
      "lemma": "إذ",
      "root": null,
      "pattern": null,
      "pos": "particle",
      "frequency": 17750,
      "features": {
        "closed_class": true
      },
      "forms": []
    },
    {
      "lemma": "إذا",
      "root": null,
      "pattern": null,
      "pos": "particle",
      "frequency": 18000,
      "features": {
        "closed_class": true
      },
      "forms": []
    },
    {
      "lemma": "إصدار",
      "root": "صدر",
      "pattern": "إفعال",
      "pos": "noun",
      "frequency": 6900,
      "features": {
        "gender": "masculine"
      },
      "forms": [
        {
          "form": "إصدارات",
          "features": {
            "number": "plural"
          }
        }
      ]
    },
    {
      "lemma": "إلى",
      "root": null,
      "pattern": null,
      "pos": "particle",
      "frequency": 24500,
      "features": {
        "closed_class": true
      },
      "forms": []
    },
    {
      "lemma": "إن",
      "root": null,
      "pattern": null,
      "pos": "particle",
      "frequency": 21000,
      "features": {
        "closed_class": true
      },
      "forms": []
    },
    {
      "lemma": "إنسان",
      "root": "أنس",
      "pattern": "إفعال",
      "pos": "noun",
      "frequency": 7800,
      "features": {
        "gender": "masculine"
      },
      "forms": [
        {
          "form": "ناس",
          "features": {
            "number": "plural"
          }
        },
        {
          "form": "إنسانة",
          "features": {
            "gender": "feminine"
          }
        }
      ]
    },
    {
      "lemma": "اتجاه",
      "root": "وجه",
      "pattern": "افتعال",
      "pos": "noun",
      "frequency": 5600,
      "features": {
        "gender": "masculine"
      },
      "forms": [
        {
          "form": "اتجاهات",
          "features": {
            "number": "plural"
          }
        }
      ]
    },
    {
      "lemma": "اتصال",
      "root": "وصل",
      "pattern": "افتعال",
      "pos": "verbal_noun",
      "frequency": 5800,
      "features": {
        "gender": "masculine"
      },
      "forms": [
        {
          "form": "اتصالات",
          "features": {
            "number": "plural"
          }
        }
      ]
    },
    {
      "lemma": "اتصل",
      "root": "وصل",
      "pattern": "افتعل",
      "pos": "verb",
      "frequency": 5800,
      "features": {},
      "forms": [
        {
          "form": "يتصل",
          "features": {
            "aspect": "imperfect"
          }
        },
        {
          "form": "اتصال",
          "features": {
            "pos": "verbal_noun"
          }
        }
      ]
    },
    {
      "lemma": "اجتماع",
      "root": "جمع",
      "pattern": "افتعال",
      "pos": "verbal_noun",
      "frequency": 7200,
      "features": {
        "gender": "masculine"
      },
      "forms": [
        {
          "form": "اجتماعات",
          "features": {
            "number": "plural"
          }
        }
      ]
    },
    {
      "lemma": "اجتمع",
      "root": "جمع",
      "pattern": "افتعل",
      "pos": "verb",
      "frequency": 5400,
      "features": {},
      "forms": [
        {
          "form": "يجتمع",
          "features": {
            "aspect": "imperfect"
          }
        },
        {
          "form": "اجتماع",
          "features": {
            "pos": "verbal_noun"
          }
        }
      ]
    },
    {
      "lemma": "اختبار",
      "root": "خبر",
      "pattern": "افتعال",
      "pos": "verbal_noun",
      "frequency": 6000,
      "features": {
        "gender": "masculine"
      },
      "forms": [
        {
          "form": "اختبارات",
          "features": {
            "number": "plural"
          }
        }
      ]
    },
    {
      "lemma": "اختبر",
      "root": "خبر",
      "pattern": "افتعل",
      "pos": "verb",
      "frequency": 3800,
      "features": {},
      "forms": [
        {
          "form": "يختبر",
          "features": {
            "aspect": "imperfect"
          }
        },
        {
          "form": "اختبار",
          "features": {
            "pos": "verbal_noun"
          }
        }
      ]
    },
    {
      "lemma": "استخدام",
      "root": "خدم",
      "pattern": "استفعال",
      "pos": "verbal_noun",
      "frequency": 7100,
      "features": {
        "gender": "masculine"
      },
      "forms": [
        {
          "form": "استخدامات",
          "features": {
            "number": "plural"
          }
        }
      ]
    },
    {
      "lemma": "استخدم",
      "root": "خدم",
      "pattern": "استفعل",
      "pos": "verb",
      "frequency": 7200,
      "features": {},
      "forms": [
        {
          "form": "يستخدم",
          "features": {
            "aspect": "imperfect"
          }
        },
        {
          "form": "استخدام",
          "features": {
            "pos": "verbal_noun"
          }
        }
      ]
    },
    {
      "lemma": "استقبال",
      "root": "قبل",
      "pattern": "استفعال",
      "pos": "verbal_noun",
      "frequency": 4300,
      "features": {
        "gender": "masculine"
      },
      "forms": []
    },
    {
      "lemma": "استقبل",
      "root": "قبل",
      "pattern": "استفعل",
      "pos": "verb",
      "frequency": 4200,
      "features": {},
      "forms": [
        {
          "form": "يستقبل",
          "features": {
            "aspect": "imperfect"
          }
        },
        {
          "form": "استقبال",
          "features": {
            "pos": "verbal_noun"
          }
        }
      ]
    },
    {
      "lemma": "استمر",
      "root": "مرر",
      "pattern": "استفعل",
      "pos": "verb",
      "frequency": 5200,
      "features": {},
      "forms": [
        {
          "form": "يستمر",
          "features": {
            "aspect": "imperfect"
          }
        }
      ]
    },
    {
      "lemma": "اكتمل",
      "root": "كمل",
      "pattern": "افتعل",
      "pos": "verb",
      "frequency": 4300,
      "features": {},
      "forms": [
        {
          "form": "يكتمل",
          "features": {
            "aspect": "imperfect"